{"assignments":[{"shard_id":"shard:synthetic-demo-1","source_id":"source:synthetic_meridian_note","source_sha256":"87abdce55610c805edcbb0f169c54de090c66ac7690652163b221d013a88eadd","worker_id":"luna-demo-worker"}],"isolation_attestation":"Synthetic demo only; no prior relation outputs were used.","luna_gate":{"locked":true,"max_unresolved_rate":0.1,"min_precision":0.9,"min_recall":0.8},"protocol_version":"protocol-v1","run_id":"run:synthetic-demo-v1","taxonomy_version":"taxonomy-v1"}
